[
  {
    "title": "Trialin Halli-SM",
    "type": "Trial",
    "date": "22.03.2025",
    "datetime": "2025-03-22 08:00",
    "location": "Tampere",
    "organizer": "Pyörä-Pojat",
    "link": "https://www.trialpyoraily.fi/halli-sm",
    "source": "manual"
  },
  {
    "title": "E-pyöräilyn SM-kilpailut",
    "type": "E-pyöräily",
    "date": "05.04.2025",
    "datetime": "2025-04-05 08:00",
    "location": "Zwift",
    "organizer": "E-pyöräilyvaliokunta",
    "source": "manual"
  },
  {
    "title": "Lattomeriajo",
    "type": "Maantie",
    "date": "21.04.2025",
    "datetime": "2025-04-21 08:00",
    "location": "Pori",
    "organizer": "Koiviston Isku ry",
    "source": "manual"
  },
  {
    "title": "67. Hyrylän ajot",
    "type": "Maantie",
    "date": "26.04.2025",
    "datetime": "2025-04-26 08:00",
    "location": "Vantaa",
    "organizer": "Cycle Club Helsinki",
    "link": "https://www.cch.fi/events/66-hyrylan-ajot",
    "source": "manual"
  },
  {
    "title": "13. Naisten etappiajo NEA",
    "type": "Maantie",
    "date": "26.04.2025",
    "datetime": "2025-04-26 08:00",
    "location": "Vantaa",
    "organizer": "Cycle Club Helsinki",
    "link": "https://www.cch.fi/events/12-naisten-etappiajo",
    "source": "manual"
  },
  {
    "title": "17. Kevätpolkaisu",
    "type": "Maantie",
    "date": "27.04.2025",
    "datetime": "2025-04-27 08:00",
    "location": "Vantaa",
    "organizer": "Cycle Club Helsinki",
    "link": "https://www.cch.fi/events/16-kevatpolkaisu",
    "source": "manual"
  },
  {
    "title": "Suomi DH Cup #1",
    "type": "Downhill (DH)",
    "date": "02.05.2025",
    "datetime": "2025-05-02 08:00",
    "location": "Klaukkala",
    "link": "https://www.tornaribikepark.com/club-tornari",
    "source": "manual"
  },
  {
    "title": "TS-kortteliajot",
    "type": "Maantie",
    "date": "03.05.2025",
    "datetime": "2025-05-03 08:00",
    "location": "Turku",
    "organizer": "Turun Urheiluliitto",
    "source": "manual"
  },
  {
    "title": "Simo Klimscheffskij’n muistoajo",
    "type": "Maantie",
    "date": "04.05.2025",
    "datetime": "2025-05-04 08:00",
    "location": "Turku",
    "organizer": "Turun Urheiluliitto",
    "source": "manual"
  },
  {
    "title": "Pyörä-Suvala XC Cup: Kiekonmaja",
    "type": "MTB XCM",
    "date": "6.5.2025",
    "datetime": "2025-05-06 08:00",
    "location": "Oulu",
    "organizer": "Roku MTB",
    "link": "https://www.rokuamtb.com/pyora-suvala-xc-cup/",
    "source": "manual"
  },
  {
    "title": "Evoc MTB",
    "type": "MTB XCM",
    "date": "10.05.2025",
    "datetime": "2025-05-10 08:00",
    "location": "Nurmijärvi",
    "organizer": "Team EVOC Finland",
    "source": "manual"
  },
  {
    "title": "Pyörä-Suvala XC Cup: Kaakkurin liikuntamaa",
    "type": "MTB XCM",
    "date": "13.5.2025",
    "datetime": "2025-05-13 08:00",
    "location": "Oulu",
    "organizer": "Roku MTB",
    "link": "https://www.rokuamtb.com/pyora-suvala-xc-cup/",
    "source": "manual"
  },
  {
    "title": "Tour De Tuusulanjärvi",
    "type": "Unknown",
    "date": "17.05.2025",
    "datetime": "2025-05-17 08:00",
    "location": "Tuusula",
    "link": "https://tourdetuusulanjarvi.fi/index.html",
    "source": "manual"
  },
  {
    "title": "Gravel Primavera I Nordic Gravel Series",
    "type": "GRAVEL",
    "date": "17.05.2025",
    "datetime": "2025-05-17 08:00",
    "location": "Espoo",
    "link": "https://nordicgravel.com/collections/gravel-primavera-borga-may-17th-2025",
    "source": "manual"
  },
  {
    "title": "AulankoMTB",
    "type": "MTB XCM",
    "date": "17.05.2025",
    "datetime": "2025-05-17 08:00",
    "location": "Hämeenlinna",
    "organizer": "Tawast Cycling Club ry",
    "source": "manual"
  },
  {
    "title": "Pyhäniemi MTB",
    "type": "MTB XCM",
    "date": "17.05.2025",
    "datetime": "2025-05-17 08:00",
    "location": "Kihniö",
    "organizer": "Polkutiimi ry",
    "source": "manual"
  },
  {
    "title": "Pyörä-Suvala XC Cup: Illinsaari MTB",
    "type": "MTB XCM",
    "date": "18.5.2025",
    "datetime": "2025-05-18 08:00",
    "location": "Oulu",
    "organizer": "Roku MTB",
    "link": "https://www.rokuamtb.com/pyora-suvala-xc-cup/",
    "source": "manual"
  },
  {
    "title": "Koli Gravel Carnival",
    "type": "Gravel",
    "date": "24.05.2025",
    "datetime": "2025-05-24 08:00",
    "location": "Koli",
    "organizer": "Koli Gravel",
    "source": "manual"
  },
  {
    "title": "Lohjanjärven ympäripyöräily",
    "type": "Unknown",
    "date": "24.05.2025",
    "datetime": "2025-05-24 08:00",
    "location": "Lohja",
    "link": "https://tapahtumat.visitlohja.fi/fi-FI/page/6724cd2c7a503d02ddc20bf4/lohjanj-rven-ymp-ripy-r-ily",
    "source": "manual"
  },
  {
    "title": "Tuusula MTB",
    "type": "MTB XCM",
    "date": "25.05.2025",
    "datetime": "2025-05-25 08:00",
    "location": "Tuusula",
    "organizer": "Tuusula MTB",
    "source": "manual"
  },
  {
    "title": "Himanka MTB",
    "type": "MTB XCM",
    "date": "25.05.2025",
    "datetime": "2025-05-25 08:00",
    "location": "Himanka",
    "organizer": "Himangan Urheilijat",
    "source": "manual"
  },
  {
    "title": "Oulujokiajo",
    "type": "Maantie",
    "date": "25.5.2025",
    "datetime": "2025-05-25 08:00",
    "location": "Oulu",
    "organizer": "OTC",
    "link": "https://www.otcoulu.fi/tapahtumat/oulujokiajo-25-5-2025/",
    "source": "manual"
  },
  {
    "title": "Toivakka MTB",
    "type": "MTB XCM",
    "date": "29.05.2025",
    "datetime": "2025-05-29 08:00",
    "location": "Jyväskylä",
    "organizer": "JYPS",
    "link": "https://www.jyps.fi/toivakkamtb",
    "source": "manual"
  },
  {
    "title": "Lapinkylän tempo",
    "type": "Aika-ajo (maantie)",
    "date": "01.06.2025",
    "datetime": "2025-06-01 08:00",
    "location": "Kirkkonummi",
    "organizer": "Idrottsklubben-32 ry",
    "link": "https://ik-32.org/toiminta/kilpailut/lapinkylan-tempo-1-6-2025/",
    "source": "manual"
  },
  {
    "title": "Kallaveden kierros",
    "type": "Maantie",
    "date": "01.06.2025",
    "datetime": "2025-06-01 08:00",
    "location": "Kuopio",
    "organizer": "Kuopion Pyöräilyseura ry",
    "link": "https://www.kuopys.fi/kallavedenkierros",
    "source": "manual"
  },
  {
    "title": "Maasto-Strava",
    "type": "MTB XCM",
    "date": "01.06.2025",
    "datetime": "2025-06-01 08:00",
    "location": "Jyväskylä",
    "organizer": "JYPS",
    "link": "http://www.jyps.fi/strava",
    "source": "manual"
  },
  {
    "title": "Tour De Koivujärven ympäripyöräily",
    "type": "Unknown",
    "date": "07.06.2025",
    "datetime": "2025-06-07 08:00",
    "location": "Kiuruvesi",
    "link": "https://www.koivujarvi.fi/aktiviteetit/tour-de-koivujarven-ymparipyoraily",
    "source": "manual"
  },
  {
    "title": "Enduro Cup osakilpailu 1",
    "type": "",
    "datetime": "2025-06-07 08:00",
    "location": "Lahti",
    "organizer": "Nifedir",
    "description": "Järjestäjä: https://royalenduro.tapahtumiin.fi/fi/",
    "link": "https://royalenduro.tapahtumiin.fi/fi/",
    "source": "csv"
  },
  {
    "title": "Porvoon ajot",
    "type": "Maantie",
    "date": "08.06.2025",
    "datetime": "2025-06-08 08:00",
    "location": "Porvoo",
    "organizer": "Porvoon Akilles",
    "source": "manual"
  },
  {
    "title": "Maantiepyöräilyn SM-kilpailut",
    "type": "Maantie",
    "date": "13.06.2025",
    "datetime": "2025-06-13 08:00",
    "location": "Jurva",
    "organizer": "Jurvan Urheilijat ja Jurvan Voima",
    "source": "manual"
  },
  {
    "title": "Parapyöräilyn SM-aika-ajo & yhteislähtö",
    "type": "Maantie",
    "date": "13.06.2025",
    "datetime": "2025-06-13 08:00",
    "location": "Jurva",
    "organizer": "Jurvan Urheilijat ja Jurvan Voima",
    "source": "manual"
  },
  {
    "title": "Midnight Sun Gravel",
    "type": "GRAVEL",
    "date": "14.06.2025",
    "datetime": "2025-06-14 08:00",
    "location": "Helsinki",
    "link": "https://www.midnightsungravel.com/",
    "source": "manual"
  },
  {
    "title": "20. Fenix MTB Marathon Laajavuori",
    "type": "MTB XCM",
    "date": "14.06.2025",
    "datetime": "2025-06-14 08:00",
    "location": "Jyväskylä",
    "organizer": "JYPS",
    "link": "https://www.jyps.fi/marathon",
    "source": "manual"
  },
  {
    "title": "Suomi DH Cup #2",
    "type": "Downhill (DH)",
    "date": "14.06.2025",
    "datetime": "2025-06-14 08:00",
    "location": "Pälkäne",
    "organizer": "Lahden Pyöräilijät",
    "link": "https://www.lahdenpyorailijat.fi/",
    "source": "manual"
  },
  {
    "title": "Pirkan pyöräily",
    "type": "Unknown",
    "date": "15.06.2025",
    "datetime": "2025-06-15 08:00",
    "location": "Tampere",
    "link": "https://www.pirkankierros.fi/pirkan-pyoraily/",
    "source": "manual"
  },
  {
    "title": "Tahko MTB",
    "type": "MTB",
    "date": "27.06.2025",
    "datetime": "2025-06-27 08:00",
    "location": "Tahko",
    "link": "https://www.tahkomtb.fi/",
    "source": "manual"
  },
  {
    "title": "Tour de Kainuu",
    "type": "Unknown",
    "date": "28.06.2025",
    "datetime": "2025-06-28 08:00",
    "location": "Vuokatti,",
    "link": "https://www.tourdekainuu.fi/",
    "source": "manual"
  },
  {
    "title": "Sora-Strava Jyväskylän seudulla",
    "type": "Gravel",
    "date": "01.07.2025",
    "datetime": "2025-07-01 08:00",
    "location": "Jyväskylä",
    "organizer": "JYPS",
    "link": "http://www.jyps.fi/sorastrava",
    "source": "manual"
  },
  {
    "title": "Nordic Gravel Series Jyväskylä",
    "type": "GRAVEL",
    "date": "04.07.2025",
    "datetime": "2025-07-04 08:00",
    "location": "Unknown",
    "link": "https://nordicgravel.com/collections/jyvaskyla",
    "source": "manual"
  },
  {
    "title": "Häähni MTB",
    "type": "MTB XCM",
    "date": "05.07.2025",
    "datetime": "2025-07-05 08:00",
    "location": "Jyväskylä",
    "organizer": "JYPS",
    "link": "https://www.jyps.fi/haahnimtb",
    "source": "manual"
  },
  {
    "title": "BMX-SM ja ISM",
    "type": "BMX",
    "date": "05.07.2025",
    "datetime": "2025-07-05 08:00",
    "location": "Turku",
    "organizer": "BMX Turku",
    "source": "manual"
  },
  {
    "title": "BMX Racing Cup",
    "type": "",
    "datetime": "2025-07-06 08:00",
    "location": "Turku",
    "organizer": "BMX Turku",
    "description": "www.bmxturku.fi",
    "link": "",
    "source": "csv"
  },
  {
    "title": "Saimaa Cycle Tour",
    "type": "Unknown",
    "date": "11.07.2025",
    "datetime": "2025-07-11 08:00",
    "location": "Imatra",
    "link": "https://saimaacycletour.com",
    "source": "manual"
  },
  {
    "title": "Ylläs Enduro SM 2025",
    "type": "Enduro",
    "date": "12.07.2025",
    "datetime": "2025-07-12 08:00",
    "location": "Lahti",
    "organizer": "Lahden Pyöräilijät",
    "link": "http://ski.yllas.fi/endurosm",
    "source": "manual"
  },
  {
    "title": "Enduro-SM",
    "type": "Enduro",
    "date": "12.07.2025",
    "datetime": "2025-07-12 08:00",
    "location": "kolari",
    "organizer": "Lahden Pyöräilijät",
    "source": "manual"
  },
  {
    "title": "11. Seutulan Kierros 2025",
    "type": "Maantie",
    "date": "13.07.2025",
    "datetime": "2025-07-13 08:00",
    "location": "Vantaa",
    "organizer": "Cycle Club Helsinki",
    "link": "https://www.cch.fi/events/11-seutulan-kierros",
    "source": "manual"
  },
  {
    "title": "Enduro Cup osakilpailu 2: Levi Midnight Enduro",
    "type": "",
    "datetime": "2025-07-17 08:00",
    "location": "Kittilä",
    "organizer": "Nifedir",
    "description": "Järjestäjä: https://royalenduro.tapahtumiin.fi/fi/",
    "link": "https://royalenduro.tapahtumiin.fi/fi/",
    "source": "csv"
  },
  {
    "title": "XCE-SM",
    "type": "MTB XCE",
    "date": "18.07.2025",
    "datetime": "2025-07-18 08:00",
    "location": "Rovaniemi",
    "organizer": "Ounaksen Pyörä-Pojat",
    "source": "manual"
  },
  {
    "title": "XCO-SM",
    "type": "MTB XCO",
    "date": "19.07.2025",
    "datetime": "2025-07-19 08:00",
    "location": "Rovaniemi",
    "organizer": "Ounaksen Pyörä-Pojat",
    "source": "manual"
  },
  {
    "title": "XCC-SM",
    "type": "MTB XCC",
    "date": "20.07.2025",
    "datetime": "2025-07-20 08:00",
    "location": "Rovaniemi",
    "organizer": "Ounaksen Pyörä-Pojat",
    "source": "manual"
  },
  {
    "title": "Kitka MTB",
    "type": "MTB",
    "date": "23.07.2025",
    "datetime": "2025-07-23 08:00",
    "location": "Rukatunturi",
    "link": "https://www.ruka.fi/fi/kitkamtb",
    "source": "manual"
  },
  {
    "title": "Suomi DH Cup #3",
    "type": "Downhill (DH)",
    "date": "24.07.2025",
    "datetime": "2025-07-24 08:00",
    "location": "Kuusamo",
    "organizer": "Ruka Freeriders",
    "link": "https://www.facebook.com/groups/rukafreeriders/",
    "source": "manual"
  },
  {
    "title": "DH-SM",
    "type": "Downhill (DH)",
    "date": "24.07.2025",
    "datetime": "2025-07-24 08:00",
    "location": "Kuusamo",
    "organizer": "Ruka Freeriders",
    "source": "manual"
  },
  {
    "title": "Kaldoaivi Ultra Road",
    "type": "MAANTIE",
    "date": "25.07.2025",
    "datetime": "2025-07-25 08:00",
    "location": "Nuorgam-Utsjoki",
    "link": "https://www.kaldoaiviultratrail.fi/en/",
    "source": "manual"
  },
  {
    "title": "Joukkueaika-ajon SM",
    "type": "Aika-ajo (maantie)",
    "date": "25.07.2025",
    "datetime": "2025-07-25 08:00",
    "location": "Porvoo",
    "organizer": "Porvoon Akilles",
    "source": "manual"
  },
  {
    "title": "Kaldoaivi Ultra MTB",
    "type": "MTB",
    "date": "26.07.2025",
    "datetime": "2025-07-26 08:00",
    "location": "Nuorgam-Utsjoki",
    "link": "https://www.kaldoaiviultratrail.fi/en/",
    "source": "manual"
  },
  {
    "title": "Maantie-ISM",
    "type": "Maantie",
    "date": "26.07.2025",
    "datetime": "2025-07-26 08:00",
    "location": "Porvoo",
    "organizer": "Porvoon Akilles",
    "source": "manual"
  },
  {
    "title": "Syöte MTB",
    "type": "MTB XCM",
    "date": "01.08.2025",
    "datetime": "2025-08-01 08:00",
    "location": "Pudasjärvi",
    "organizer": "Krossikommuuni ry",
    "source": "manual"
  },
  {
    "title": "Suomi DH Cup #4",
    "type": "Downhill (DH)",
    "date": "01.08.2025",
    "datetime": "2025-08-01 08:00",
    "location": "Tampere",
    "link": "https://www.facebook.com/mustistrailcrew/",
    "source": "manual"
  },
  {
    "title": "Maantie-Strava Jyväskylän seudulla",
    "type": "Maantie",
    "date": "01.08.2025",
    "datetime": "2025-08-01 08:00",
    "location": "Jyväskylä",
    "organizer": "JYPS",
    "link": "http://www.jyps.fi/maantiestrava",
    "source": "manual"
  },
  {
    "title": "Dirty Sipoo x NGS",
    "type": "Unknown",
    "date": "02.08.2025",
    "datetime": "2025-08-02 08:00",
    "location": "Unknown",
    "link": "https://nordicgravel.com/collections/dirty-sipoo-02-08-2025",
    "source": "manual"
  },
  {
    "title": "Suomi DH Cup #5",
    "type": "Downhill (DH)",
    "date": "02.08.2025",
    "datetime": "2025-08-02 08:00",
    "location": "Tampere",
    "link": "https://www.facebook.com/mustistrailcrew/",
    "source": "manual"
  },
  {
    "title": "Gravel-SM",
    "type": "Gravel",
    "date": "02.08.2025",
    "datetime": "2025-08-02 08:00",
    "location": "Sipoo",
    "organizer": "Sibbo Vargarna ja Nordic Gravel Series",
    "source": "manual"
  },
  {
    "title": "Syötekylä Gravel Fest",
    "type": "Gravel",
    "date": "03.08.2025",
    "datetime": "2025-08-03 08:00",
    "location": "Pudasjärvi",
    "organizer": "Krossikommuuni ry",
    "source": "manual"
  },
  {
    "title": "Puss Weekend",
    "type": "Unknown",
    "date": "08.08.2025",
    "datetime": "2025-08-08 08:00",
    "location": "Sappee",
    "link": "https://www.pusscamp.com/pages/puss-weekend",
    "source": "manual"
  },
  {
    "title": "Himos Epic MTB",
    "type": "MTB XCM",
    "date": "08.08.2025",
    "datetime": "2025-08-08 08:00",
    "location": "Jämsä",
    "organizer": "CC Ilves",
    "source": "manual"
  },
  {
    "title": "Luonterin pyöräily",
    "type": "Unknown",
    "date": "09.08.2025",
    "datetime": "2025-08-09 08:00",
    "location": "Mikkeli-Anttola",
    "link": "https://www.mikkelinklassikot.fi/luonteri-pyoraily/",
    "source": "manual"
  },
  {
    "title": "FNLD GRVL",
    "type": "GRAVEL",
    "date": "09.08.2025",
    "datetime": "2025-08-09 08:00",
    "location": "Lahti",
    "link": "https://www.fnldgrvl.com",
    "source": "manual"
  },
  {
    "title": "Korkeakangas-XCO",
    "type": "MTB XCO",
    "date": "09.08.2025",
    "datetime": "2025-08-09 08:00",
    "location": "Valkeakoski",
    "organizer": "Valkeakosken Maastopyöräseura Ry",
    "source": "manual"
  },
  {
    "title": "BotniaMTB",
    "type": "MTB XCM",
    "date": "09.08.2025",
    "datetime": "2025-08-09 08:00",
    "location": "Vöyri",
    "organizer": "NorrvallaSport",
    "source": "manual"
  },
  {
    "title": "Terva-ajot",
    "type": "Maantie",
    "date": "09.08.2025",
    "datetime": "2025-08-09 08:00",
    "location": "Muhos",
    "organizer": "Terva-ajot",
    "source": "manual"
  },
  {
    "title": "Korkeakangas-MTB",
    "type": "MTB XCM",
    "date": "10.08.2025",
    "datetime": "2025-08-10 08:00",
    "location": "Valkeakoski",
    "organizer": "Valkeakosken Maastopyöräseura Ry",
    "source": "manual"
  },
  {
    "title": "Maantiepyöräilyn kortteli-SM ja ISM",
    "type": "Maantie",
    "date": "10.08.2025",
    "datetime": "2025-08-10 08:00",
    "location": "Oulu",
    "organizer": "Terva-ajot",
    "source": "manual"
  },
  {
    "title": "XCM-SM",
    "type": "MTB XCM",
    "date": "16.08.2025",
    "datetime": "2025-08-16 08:00",
    "location": "Kajaani",
    "organizer": "Sky High Events",
    "source": "manual"
  },
  {
    "title": "Enduro Cup osakilpailu 3: Ellivuori",
    "type": "",
    "datetime": "2025-08-16 08:00",
    "location": "sastamala",
    "organizer": "Nifedir",
    "description": "Järjestejä: https://royalenduro.tapahtumiin.fi/fi/",
    "link": "https://royalenduro.tapahtumiin.fi/fi/",
    "source": "csv"
  },
  {
    "title": "Sorahiisi",
    "type": "Unknown",
    "date": "22.08.2025",
    "datetime": "2025-08-22 08:00",
    "location": "Koli",
    "link": "https://www.sorahiisi.fi/",
    "source": "manual"
  },
  {
    "title": "Saariselkä MTB Stages",
    "type": "MTB",
    "date": "22.08.2025",
    "datetime": "2025-08-22 08:00",
    "location": "Unknown",
    "link": "http://saariselkamtb.fi",
    "source": "manual"
  },
  {
    "title": "Ruska-ajot",
    "type": "MTB XCC",
    "date": "30.08.2025",
    "datetime": "2025-08-30 08:00",
    "location": "Rovaniemi",
    "organizer": "Ounaksen Pyörä-Pojat",
    "source": "manual"
  },
  {
    "title": "6  Helsinki Velotour Race",
    "type": "Maantie",
    "date": "30.08.2025",
    "datetime": "2025-08-30 08:00",
    "location": "Espoo",
    "organizer": "Helsinki Velotour",
    "source": "manual"
  },
  {
    "title": "Halssila MTB / Keski-Suomen maastomestaruus",
    "type": "MTB XCM",
    "date": "02.09.2025",
    "datetime": "2025-09-02 08:00",
    "location": "Jyväskylä",
    "organizer": "JYPS",
    "link": "https://www.jyps.fi/halssilamtb",
    "source": "manual"
  },
  {
    "title": "25. Leppälahtitempo",
    "type": "Aika-ajo (maantie)",
    "date": "03.09.2025",
    "datetime": "2025-09-03 08:00",
    "location": "Jyväskylä",
    "organizer": "JYPS",
    "link": "https://www.jyps.fi/leppalahtitempo",
    "source": "manual"
  },
  {
    "title": "Falling Leaves Lahti",
    "type": "Unknown",
    "date": "05.09.2025",
    "datetime": "2025-09-05 08:00",
    "location": "Lahti",
    "link": "https://nordicgravel.com/collections/falling-leaves-lahti-2025",
    "source": "manual"
  },
  {
    "title": "BMX Racing Suomi Cup 4, Laukaa",
    "type": "BMX",
    "date": "07.09.2025",
    "datetime": "2025-09-07 08:00",
    "location": "Laukaa",
    "organizer": "CC Picaro",
    "source": "manual"
  },
  {
    "title": "27. Luukki MTB & GRAVEL",
    "type": "MTB XCM",
    "date": "07.09.2025",
    "datetime": "2025-09-07 08:00",
    "location": "Espoo",
    "organizer": "Cycle Club Helsinki",
    "link": "https://www.cch.fi/events/26-luukki-mtb-gravel-2024",
    "source": "manual"
  },
  {
    "title": "Vihtavuoren cyclocross ja MTB",
    "type": "Cyclocross",
    "date": "09.09.2025",
    "datetime": "2025-09-09 08:00",
    "location": "Laukaa",
    "organizer": "JYPS",
    "link": "https://www.jyps.fi/vihtavuoricc",
    "source": "manual"
  },
  {
    "title": "Suomi DH Cup #6",
    "type": "Downhill (DH)",
    "date": "12.09.2025",
    "datetime": "2025-09-12 08:00",
    "location": "Nilsiä",
    "link": "https://www.savomtb.fi/",
    "source": "manual"
  },
  {
    "title": "Lieto Gravel Tour",
    "type": "Gravel",
    "date": "13.09.2025",
    "datetime": "2025-09-13 08:00",
    "location": "Lieto",
    "organizer": "Team Velo Cycling",
    "source": "manual"
  },
  {
    "title": "Hiekkojen Herruus MTB & Trail Run",
    "type": "MTB XCM",
    "date": "13.09.2025",
    "datetime": "2025-09-13 08:00",
    "location": "Kalajoki",
    "source": "manual"
  },
  {
    "title": "BMX Racing Suomi Cup 5 ja 6",
    "type": "",
    "datetime": "2025-09-13 08:00",
    "location": "Helsinki",
    "organizer": "BMX Helsinki",
    "description": "Kutsu ilmestyy sivulle www.bmxhelsinki.net",
    "link": "",
    "source": "csv"
  },
  {
    "title": "Enduro Cup osakilpailu 4: Ukkohalla",
    "type": "",
    "datetime": "2025-09-13 08:00",
    "location": "Hyrynsalmi",
    "organizer": "Nidefir",
    "description": "Järjestäjä: https://royalenduro.tapahtumiin.fi/fi/",
    "link": "https://royalenduro.tapahtumiin.fi/fi/",
    "source": "csv"
  },
  {
    "title": "Syysetapit",
    "type": "Maantie",
    "date": "13.09.2025",
    "datetime": "2025-09-13 08:00",
    "location": "Pomarkku",
    "organizer": "Porin Tarmo",
    "source": "manual"
  },
  {
    "title": "KiipulaMTB",
    "type": "MTB XCM",
    "date": "28.09.2025",
    "datetime": "2025-09-28 08:00",
    "location": "Janakkala",
    "organizer": "Tawast Cycling Club ry",
    "source": "manual"
  },
  {
    "title": "Cyclocross-SM 2026",
    "type": "Cyclocross",
    "date": "25.10.2025",
    "datetime": "2025-10-25 08:00",
    "location": "Espoo",
    "organizer": "IK-32",
    "source": "manual"
  }
]